<?xml version="1.0" encoding="UTF-8"?>
<!DOCTYPE list SYSTEM "skills.dtd">
<list>
	<skill id="20000" levels="1" name="Treasure Hunter Search" >
		<!--  Automatically generated from The High Five: Part 4.5 client files.
		  Description: none
		  Target is set to TARGET_NONE, skillType  to NOTDONE for server compatability.
		  created 07-7-2011  19:19
		-->
		<set name="icon" val="BranchSys2.icon.br_s_search_treasure1_i00" />
		<set name="target" val="TARGET_NONE" />
		<set name="skillType" val="NOTDONE" />
		<set name="operateType" val="OP_ACTIVE" />
	</skill>
	<skill id="20001" levels="1" name="Treasure Hunter Hammer Punch" >
		<!--  Automatically generated from The High Five: Part 4.5 client files.
		  Description: none
		  Target is set to TARGET_NONE, skillType  to NOTDONE for server compatability.
		  created 07-7-2011  19:19
		-->
		<set name="icon" val="BranchSys2.icon.br_s_hammerpunch_treasure1_i001" />
		<set name="target" val="TARGET_NONE" />
		<set name="skillType" val="NOTDONE" />
		<set name="operateType" val="OP_ACTIVE" />
	</skill>
	<skill id="20002" levels="1" name="Dragon Kick" >
		<!--  Automatically generated from The High Five: Part 4.5 client files.
		  Description: none
		  Target is set to TARGET_NONE, skillType  to NOTDONE for server compatability.
		  created 07-7-2011  19:19
		-->
		<set name="icon" val="icon.skill_transform_s_attack" />
		<set name="target" val="TARGET_NONE" />
		<set name="skillType" val="NOTDONE" />
		<set name="operateType" val="OP_ACTIVE" />
	</skill>
	<skill id="20003" levels="1" name="Dragon Slash" >
		<!--  Automatically generated from The High Five: Part 4.5 client files.
		  Description: none
		  Target is set to TARGET_NONE, skillType  to NOTDONE for server compatability.
		  created 07-7-2011  19:19
		-->
		<set name="icon" val="icon.skill_transform_s_attack" />
		<set name="target" val="TARGET_NONE" />
		<set name="skillType" val="NOTDONE" />
		<set name="operateType" val="OP_ACTIVE" />
	</skill>
	<skill id="20004" levels="1" name="Dragon Dash" >
		<!--  Automatically generated from The High Five: Part 4.5 client files.
		  Description: none
		  Target is set to TARGET_NONE, skillType  to NOTDONE for server compatability.
		  created 07-7-2011  19:19
		-->
		<set name="icon" val="icon.skill_transform_buff" />
		<set name="target" val="TARGET_NONE" />
		<set name="skillType" val="NOTDONE" />
		<set name="operateType" val="OP_ACTIVE" />
	</skill>
	<skill id="20005" levels="1" name="Dragon Aura" >
		<!--  Automatically generated from The High Five: Part 4.5 client files.
		  Description: none
		  Target is set to TARGET_NONE, skillType  to NOTDONE for server compatability.
		  created 07-7-2011  19:19
		-->
		<set name="icon" val="icon.skill_transform_buff" />
		<set name="target" val="TARGET_NONE" />
		<set name="skillType" val="NOTDONE" />
		<set name="operateType" val="OP_ACTIVE" />
	</skill>
	<skill id="20006" levels="1" name="Soul Roar" >
		<set name="icon" val="BranchSys2.icon.skill20006" />
		<table name="#effectPoint">611</table>
		<table name="#magicLevel">62</table>
		<set name="reuseDelay" val="240000" />
		<set name="hitTime" val="1500" />
		<set name="hitCancelTime" val="350" />
		<set name="mpConsume1" val="58" />
		<set name="mpConsume2" val="14" />
		<set name="effectPoint" val="#effectPoint" />
		<set name="magicLevel" val="#magicLevel" />
		<set name="target" val="TARGET_SELF" />
		<set name="skillType" val="BUFF" />
		<set name="operateType" val="OP_ACTIVE" />
		<for>
			<effect count="1" name="Buff" time="600" val="0">
				<mul order="0x30" stat="maxHp" val="1.15" />
				<mul order="0x30" stat="maxCp" val="1.15" />
			</effect>
			<effect count="1" name="HealPercent" time="0" val="15"/>
			<effect count="1" name="HealCPPercent" time="0" val="15"/>
		</for>
	</skill>
</list>
