<?xml version="1.0" encoding="UTF-8"?>
<!DOCTYPE list SYSTEM "skills.dtd">
<list>
	<skill id="14156" levels="1" name="Snake" >
		<!--  Automatically generated from The High Five: Part 4.5 client files.
		  Description: none
		  Target is set to TARGET_NONE, skillType  to NOTDONE for server compatability.
		  created 07-7-2011  19:19
		-->
		<set name="icon" val="icon.skill0006" />
		<set name="target" val="TARGET_NONE" />
		<set name="skillType" val="NOTDONE" />
		<set name="operateType" val="OP_ACTIVE" />
	</skill>
	<skill id="14157" levels="1" name="Long Snake" >
		<!--  Automatically generated from The High Five: Part 4.5 client files.
		  Description: none
		  Target is set to TARGET_NONE, skillType  to NOTDONE for server compatability.
		  created 07-7-2011  19:19
		-->
		<set name="icon" val="icon.skill0006" />
		<set name="target" val="TARGET_NONE" />
		<set name="skillType" val="NOTDONE" />
		<set name="operateType" val="OP_ACTIVE" />
	</skill>
	<skill id="14158" levels="1" name="Crawler Spear" >
		<!--  Automatically generated from The High Five: Part 4.5 client files.
		  Description: none
		  Target is set to TARGET_NONE, skillType  to NOTDONE for server compatability.
		  created 07-7-2011  19:19
		-->
		<set name="icon" val="icon.skill0006" />
		<set name="target" val="TARGET_NONE" />
		<set name="skillType" val="NOTDONE" />
		<set name="operateType" val="OP_ACTIVE" />
	</skill>
	<skill id="14164" levels="1" name="Akain Jet" >
		<!--  Automatically generated from The High Five: Part 4.5 client files.
		  Description: none
		  Target is set to TARGET_NONE, skillType  to NOTDONE for server compatability.
		  created 07-7-2011  19:19
		-->
		<set name="icon" val="icon.skill1275" />
		<set name="target" val="TARGET_NONE" />
		<set name="skillType" val="NOTDONE" />
		<set name="operateType" val="OP_ACTIVE" />
	</skill>
	<skill id="14165" levels="1" name="Akain Burst" >
		<!--  Automatically generated from The High Five: Part 4.5 client files.
		  Description: none
		  Target is set to TARGET_NONE, skillType  to NOTDONE for server compatability.
		  created 07-7-2011  19:19
		-->
		<set name="icon" val="icon.skill1275" />
		<set name="target" val="TARGET_NONE" />
		<set name="skillType" val="NOTDONE" />
		<set name="operateType" val="OP_ACTIVE" />
	</skill>
	<skill id="14167" levels="1" name="Black Powder" >
		<!--  Automatically generated from The High Five: Part 4.5 client files.
		  Description: none
		  Target is set to TARGET_NONE, skillType  to NOTDONE for server compatability.
		  created 07-7-2011  19:19
		-->
		<set name="icon" val="icon.skill0006" />
		<set name="target" val="TARGET_NONE" />
		<set name="skillType" val="NOTDONE" />
		<set name="operateType" val="OP_ACTIVE" />
	</skill>
	<skill id="14168" levels="1" name="Throw Granade" >
		<!--  Automatically generated from The High Five: Part 4.5 client files.
		  Description: none
		  Target is set to TARGET_NONE, skillType  to NOTDONE for server compatability.
		  created 07-7-2011  19:19
		-->
		<set name="icon" val="icon.skill1275" />
		<set name="target" val="TARGET_NONE" />
		<set name="skillType" val="NOTDONE" />
		<set name="operateType" val="OP_ACTIVE" />
	</skill>
</list>
